title,link,abstract
Making Sense of Art: Access for Gallery Visitors with Vision Impairments,https://dl.acm.org/doi/10.1145/3290605.3300250,"
While there is widespread recognition of the need to provide people with vision impairments (PVI) equitable access to cultural institutions such as art galleries, this is not easy. We present the results of a collaboration with a regional art gallery who wished to open their collection to PVIs in the local community. We describe a novel model that provides three different ways of accessing the gallery, depending upon visual acuity and mobility: virtual tours, self-guided tours and guided tours. As far as possible the model supports autonomous exploration by PVIs. It was informed by a value sensitive design exploration of the values and value conflicts of the primary stakeholders. In this paper we have presented a values-based model for providing people with vision impairments equitable access to art galleries. The model was developed in collaboration with a regional gallery using value sensitive design. We conducted a formative study comparing different tactile presentation methods, then our main study which explored stakeholder values and initial ideas for the model. Finally, we conducted a pilot evaluation. User evaluation was extremely positive, and BAG is now planning to deploy the model more widely. Our research provides the first values-based framework and model for accessible access to cultural institutions. In particular, it highlights the importance of supporting independence and autonomy of visitors with visual impairments, and involving the artists when developing audio descriptions and translating their work into other sensory modalities. By clarifying stakeholder values and conflicts, our research helps ground future research into the use of IT technologies for this purpose. For example, it demonstrates the importance of providing online access both for PVIs with limited mobility and to prepare more mobile PVIs for a physical visit. Further, it motivates the use of digital design and manufacturing techniques such as 3D printing and laser cutting in the production of tactile presentations as well as research into wayfinding technologies for use in the gallery and supporting access with emerging virtual and augmented reality systems.

"
Co-Design Beyond Words: 'Moments of Interaction' with Minimally-Verbal Children on the Autism Spectrum,https://dl.acm.org/doi/10.1145/3290605.3300251,"
Existing co-design methods support verbal children on the autism spectrum in the design process, while their minimally-verbal peers are overlooked. We describe Co-Design Beyond Words (CDBW), an approach which merges existing co-design methods with practice-based methods from Speech and Language Therapy which are child-led and interests-based. These emphasise the rich detail that can be conveyed in the moment, through recognising occurrences of, for example, Joint Attention, Turn Taking and Imitation. We worked in an autism-specific primary school over 20 weeks with ten children, aged 5 to 8. We co-designed a playful prototype, the TangiBall, using the three iterative phases of CDBW; the Foundation Phase (preparation for interaction), the Interaction Phase (designing-and-reflecting in the moment) and the Reflection Phase (reflection-on-action). We contribute a novel co-design approach and present moments of interaction, the micro instances in design in which minimally-verbal children on the spectrum can convey meaning beyond words, through their actions, interactions, and attentional foci. These moments of interaction provide design insight, shape design direction, and reveal unique strengths, interests, and abilities. This work contributes Co-Design Beyond Words, a childled approach to co-design with minimally-verbal children on the autism spectrum. This approach values moments of interaction – social instances of connection, communication, or understanding between individuals (such as children and facilitating adults). We suggest that moments of interaction are important during the co-design process, as current codesign approaches operate at high cognitive and social levels, often misaligned with the existing skills and motivations of minimally-verbal children on the autism spectrum. This paper identifies an opportunity, and perhaps an obligation, for HCI researchers to address this imbalance. We highlight the importance of working towards methods, designs, and mind-sets that are inclusive, supportive, and empowering of minimally-verbal children on the autism spectrum and other communities who communicate differently, as we work towards answering the question: how does one have a voice in design if one is not verbal?
"
Emotional Utility and Recall of the Facebook News Feed,https://dl.acm.org/doi/10.1145/3290605.3300252,"
We report a laboratory study (N=53) in which participants browsed their own Facebook news feeds for 10-15 minutes, choosing exactly when to quit, and later rated the overall emotional utility of the episode before attempting to recall threads. Finally, the emotional utility of each encountered thread was rated while looking over a recording of the interaction. We report that Facebook browsing was, overall, an emotionally positive experience; that recall of threads exhibited classic primacy and recency serial order effects; that recalled threads were both more positive and more valenced (less neutral) on average, than forgotten threads; and that overall emotional valence judgments were predicted, statistically, by the peak and end thread judgments. We find no evidence that local quit decisions were driven by the emotional utility of threads. In the light of these findings, we discuss the suggestion that emotional utility might partly explain the attractiveness of reading the news feed, and that an emotional memory bias might further increase the attractiveness of the newsfeed in prospect. Our main, overarching aim in this study is to introduce the idea of emotional utility, and how this interacts with memory as part of the explanation for the attractiveness of the Facebook news feed. Our experiment has demonstrated the potential of using simple emotional utility ratings to throw light on aspects of Facebook use, and, in particular, on how memory for the experience of using Facebook might contribute to its attractiveness in prospect.
"
"The Breaking Hand: Skills, Care, and Sufferings of the Hands of an Electronic Waste Worker in Bangladesh",https://dl.acm.org/doi/10.1145/3290605.3300253,"
While repair work has recently been getting increasing attention in HCI, recycling practices have still remained relatively understudied, especially in the context of the Global South. To this end, building on our eight-month-long ethnography, this paper reports the electronic waste (`e-waste', henceforth) recycling practices among the e-waste recycler (`bhangari') communities in Dhaka, Bangladesh. In doing so, this paper offers the work of the bhangaris through an articulation of their hands and their uses. Drawing from a rich body of scholarly work on social science, we define and contextualize three characteristics of the hand of a bhangari: knowledge, care, and skills and collaboration. Our study also highlights the pains and sufferings involved in this profession. By explaining bhangari work through the hand, we also discuss its implications for design, and its connection to HCI's broader interest in sustainability. In the sections above, we have presented the electronic recycling practices in the main four e-waste markets in Dhaka, Bangladesh. We have shown how bhangaris, the e-waste workers, collect, sort, dismantle, and dispose broken electronics step-by-step. We have further focused on the role of the hand of bhangaris to deepen our understanding of their work. We have demonstrated how the hand of a bhangari is used to know, extend care, and perform collaborative and skillful work in this profession. Finally, we have also reported the pains and suffering of their hand due to various injuries and exposure to harmful chemicals. This study thus provides a deep understanding of bhangaris’ interaction with broken computing devices, and open up new scopes for HCI in both design and theory fronts. First, our work documents the informal process of e-waste management, an area that has been under-explored in HCI. This paper joins the growing body of work on the afteruse phase of digital technologies in informal markets in the Global South, and demonstrates the important human factors involved in it. Through an articulation of handworks, our study shows how bhangaris’ skills, experience, art, craft, knowledge, and suffering are involved in the e-waste management in Bangladesh. We note that bhangari works are often undervalued (our own study shows bhangaris are often neglected in the society), but they contribute significantly to sustainable digital consumption. Our study also shows how bhangari markets are also a place of innovation, repurposing, and improvisation, which supports similar observations in other places in the global south [11, 12, 65]. While such innovation in the repair market is often confined within producing novel electronics, bhangaris innovate all kinds of artifacts - starting from looking glass to the toothpick, and from paperweight to hair comb. Hence, we posit that bhangari work should be considered as an important site for innovation and sustainability studies in HCI. Second, our work demonstrates an unsafe working condition for the bhangaris. We have also discussed the sociotechnical complexities around this problem of occupational hazards in bhangari work. We call for HCI research to take a deeper look into this issue, along with the ongoing policy initiatives coming from other disciplines [55, 78, 90]. HCI research can focus on designing safe tools, techniques, and workplaces that will protect the bhangaris from the physical harm associated with recycling broken electronics in different phases. Considering the social and economic conditions of the bhangaris, design of such artifacts should be inexpensive and culturally appropriate. Besides such direct design interventions to bhangari work, we can also design technologies to create mass awareness, and a nation-wide movement to persuade the government to make policy and enforce laws that are required to ensure a safe working environment for this vulnerable and marginalized population in Bangladesh. Third, our study brings to the fore the tactile experiences of touching the broken electronics - a barely explored area in HCI. HCI’s central focus on ‘design’ and ‘use’ of technology has mostly confined the experience of touch within these two phases of the life-cycle of a technology. As a result, a rich set of experiences that take place when people touch a nonfunctioning, malfunctioning, or broken technologies have not gotten enough attention in HCI. This paper intends to draw the attention of HCI researchers of tangible interfaces and ergonomics to the tactile experiences of the bhangaris while interacting with the broken electronics. We argue that a research that may stem from this work can benefit HCI research on tangible interfaces in various ways. For example, by extending the designer’s vision from use to after-use phase will allow them to take into account the tactile experiences of the electronic waste workers in their design, as also indicated by Maestri and Wakkary [51]. Novel technologies can be built that are equally friendly for the users, repairers, and recyclers. Furthermore, many of the tactile experiences and hand activities of bhangari work can introduce many novel interactions in HCI. For example, twisting, pinching, rubbing, or bending an electronic device may introduce new modes of interactions with computing devices that are not much prevalent today. Fourth, in this study, we have used hand as the center of our analysis of bhangari work. There are many professions, especially art and craft works, that are mostly done by hand. Hence, the hand has long been a center of interest for social scientists and anthropologists [27, 53, 54, 93]. While many works require our active and skillful interactions with computing devices through hands, it is still a relatively an underused method of understanding human-computer interaction in HCI research. It should be noted that a long-standing HCI work on ergonomics looks at hand in a very functional dimension (and measure comfort, ease, efficiency through performances). However, the hand that we propose to study goes far beyond that and encompasses the emotional, artistic, skillful, emotional, and political dimensions of work. In this paper, by putting the hand at the center, we have shown how different modes of a hand constitute the work of breaking computers and how a rich set of human emotions and social contexts are attached to them. Studying hands will provide a detailed explanation of the skills involved in a work, and the politics and emotions associated with them. We argue that such findings are valuable in designing better technologies that embody tangible experiences of users, by leveraging the functional and emotional dimensions of work.

"
EarTouch: Facilitating Smartphone Use for Visually Impaired People in Mobile and Public Scenarios,https://dl.acm.org/doi/10.1145/3290605.3300254,"
Interacting with a smartphone using touch input and speech output is challenging for visually impaired people in mobile and public scenarios, where only one hand may be available for input (e.g., while holding a cane) and using the loudspeaker for speech output is constrained by environmental noise, privacy, and social concerns. To address these issues, we propose EarTouch, a one-handed interaction technique that allows the users to interact with a smartphone using the ear to perform gestures on the touchscreen. Users hold the phone to their ears and listen to speech output from the ear speaker privately. We report how the technique was designed, implemented, and evaluated through a series of studies. Results show that EarTouch is easy, efficient, fun and socially acceptable to use. We present EarTouch, a novel interaction technique that facilitates smartphone use for BVI people in mobile and public scenarios. EarTouch not only improves one-handed use, but also provides an alternative to protect privacy and avoid social awkwardness. We actively engaged 36 BVI smartphone users in the design and evaluation of EarTouch based on formative interviews and user-participatory design activities. In a broader sense, EarTouch brings us an important step closer to accessible smartphones for all users of all abilities.

"
Diagnosing and Coping with Mode Errors in Korean-English Dual-language Keyboard,https://dl.acm.org/doi/10.1145/3290605.3300255,"
In countries where languages with non-Latin characters are prevalent, people use a keyboard with two language modes namely, the native language and English, and often experience mode errors. To diagnose the mode error problem, we conducted a field study and observed that 78% of the mode errors occurred immediately after application switching. We implemented four methods (Auto-switch, Preview, Smart-toggle, and Preview & Smart-toggle) based on three strategies to deal with the mode error problem and conducted field studies to verify their effectiveness. In the studies considering Korean-English dual input, Auto-switch was ineffective. On the contrary, Preview significantly reduced the mode errors from 75.1% to 41.3%, and Smart-toggle saved typing cost for recovering from mode errors. In Preview & Smart-toggle, Preview reduced mode errors and Smart-toggle handled 86.2% of the mode errors that slipped past Preview. These results suggest that Preview & Smart-toggle is a promising method for preventing mode errors for the Korean-English dual-input environment. In this study, we observed that a majority (78.3%) of the mode errors occurred immediately after an application switch. We considered four methods to help users deal with mode errors that follow an application switch. Through a series of field studies in the Korean-English dual-input environment, we observed that Auto-switch was not accepted well, Preview could reduce the mode errors significantly (from 75.1% to 41.3%), and Smart-toggle was adopted well by users (71.4% of the time). We also observed that Preview & Smart-toggle was an effective complementary combination of Preview and Smart-toggle. We conclude that Preview & Smart-toggle is the best among the four methods for preventing mode errors for the Korean-English dual-input environment.

"
Impact of Contextual Factors on Snapchat Public Sharing,https://dl.acm.org/doi/10.1145/3290605.3300256,"
Public sharing is integral to online platforms. This includes the popular multimedia messaging application Snapchat, on which public sharing is relatively new and unexplored in prior research. In mobile-first applications, sharing contexts are dynamic. However, it is unclear how context impacts users' sharing decisions. As platforms increasingly rely on user-generated content, it is important to also broadly understand user motivations and considerations in public sharing. We explored these aspects of content sharing through a survey of 1,515 Snapchat users. Our results indicate that users primarily have intrinsic motivations for publicly sharing Snaps, such as to share an experience with the world, but also have considerations related to audience and sensitivity of content. Additionally, we found that Snaps shared publicly were contextually different from those privately shared. Our findings suggest that content sharing systems can be designed to support sharing motivations, yet also be sensitive to private contexts. We conducted a survey to explore the role of context in sharing decisions on Snapchat, as well as users’ general motivations and considerations when publicly sharing content. We observed that some contexts, such as Snaps of people or Snaps taken inside a home, were more likely to be privately shared to My Story, and were associated with less comfort with publicly sharing to Our Story. Additionally, participants’ motivations for public sharing were largely intrinsic, while considerations centered around the audience and content of the Snap. As such, our indings can inform the design of context-aware applications to better support user decisionmaking and preferences.

"
Cluster Touch: Improving Touch Accuracy on Smartphones for People with Motor and Situational Impairments,https://dl.acm.org/doi/10.1145/3290605.3300257,"
We present Cluster Touch, a combined user-independent and user-specific touch offset model that improves the accuracy of touch input on smartphones for people with motor impairments, and for people experiencing situational impairments while walking. Cluster Touch combines touch examples from multiple users to create a shared user-independent touch model, which is then updated with touch examples provided by an individual user to make it user-specific. Owing to this combination, Cluster Touch allows people to quickly improve the accuracy of their smartphones by providing only 20 touch examples. In a user study with 12 people with motor impairments and 12 people without motor impairments, but who were walking, Cluster Touch improved touch accuracy by 14.65% for the former group and 6.81% for the latter group over the native touch sensor. Furthermore, in an offline analysis of existing mobile interfaces, Cluster Touch improved touch accuracy by 8.21% and 4.84% over the native touch sensor for the two user groups, respectively. We have investigated touch offsets created by people with motor impairments, and by people without impairments while walking and standing. Our analysis found that users across groups exhibited similar touch behaviors regarding where touches occur relative to their intended targets, but that the magnitude of these errors was more pronounced for people with motor impairments and for walking people than for people who were standing. To improve touch screen accuracy for people with motor impairments, and for people in motor-impairing situations, we created Cluster Touch, a combined user-independent and user-specific touch model that can improve touch accuracy by collecting only 20 touch examples from the target user. In an evaluation of Cluster Touch, we found that it was significantly more accurate in predicting intended target locations for people with motor impairments than the touch sensors found in the Google Nexus 6 smartphone. Cluster Touch also improved accuracy over two prior statistical machine learning models, Gaussian Process [55] and Linear Offset [9]. We also found that Cluster Touch was able to improve touch accuracy for people without impairments who were walking, demonstrating that Cluster Touch has the potential to provide accuracy improvements for a range of users in different situations.
"
MindDot: Supporting Effective Cognitive Behaviors in Concept Map-Based Learning Environments,https://dl.acm.org/doi/10.1145/3290605.3300258,"
While prior research has revealed the promising impact of concept mapping on learning, few have comprehensively modeled different cognitive behaviors during concept mapping. In addition, existing concept mapping tools lack effective feedback to support better learning behaviors. This work presents MindDot, a concept map-based learning environment that facilitates the cognitive process of comparing and integrating related concepts via two forms of support. A hyperlink support and an expert template. Study results suggested that both types of support had positive impact on the development of comparative strategies and that hyperlink support enhanced learning. We further evaluated the cognitive learning progress at a fine-grained level with two forms of visualizations. We then extracted several behavioral patterns that provided insights about the cognitive progress in learning. Lastly, we derive design recommendations that we hope will inspire future intelligent tutoring systems that automatically evaluate students' learning behaviors and foster them in developing effective learning behaviors. In this work, we presented MindDot, a concept map based learning environment that supports concept mapping through innovative integration of two features, hyperlink navigation and expert template. The strength and novelty of our system lie in its ability to assist students in developing comparative strategies. Our controlled study showed that students with hyperlink support outperformed the ones without hyperlink support. The system also demonstrated promising impact on supporting comparative strategies. We then presented a deeper and fine-grained understanding of how students employ comparative strategies, finding that there are indeed certain sequences of behaviors in the text (e.g., reading before adding a link) that suggest that students are making comparisons. Finally, we derive three major design recommendations for future concept mapping systems to foster the development of comparative strategies and enhancing learning outcomes: integrate tools with learning content, provide support that doubles as assessment, and adaptively support comparative strategies. Using computer-based concept mapping tools to facilitate concept mapping processes has the potential to substantially improve students’ abilities to comprehend expository texts.

"
