title,link,abstract
In a Silent Way: Communication Between AI and Improvising Musicians Beyond Sound,https://dl.acm.org/doi/10.1145/3290605.3300268,"
Collaboration is built on trust, and establishing trust with a creative Artificial Intelligence is difficult when the decision process or internal state driving its behaviour isn't exposed. When human musicians improvise together, a number of extra-musical cues are used to augment musical communication and expose mental or emotional states which affect musical decisions and the effectiveness of the collaboration. We developed a collaborative improvising AI drummer that communicates its confidence through an emoticon-based visualisation. The AI was trained on musical performance data, as well as real-time skin conductance, of musicians improvising with professional drummers, exposing both musical and extra-musical cues to inform its generative process. Uni- and bi-directional extra-musical communication with real and false values were tested by experienced improvising musicians. Each condition was evaluated using the FSS-2 questionnaire, as a proxy for musical engagement. The results show a positive correlation between extra-musical communication of machine internal state and human musical engagement. As interaction with Artificial Intelligences – and in particular creative improvisers – becomes more commonplace, how we interact and collaborate with co-creational AI systems is an increasingly important area of research. In this paper we have investigated how extra-musical cues between human and AI improvisers can affect the achievement of flow states in an improvising duet. Our results demonstrate that, at least for the performers evaluated, communication of a confidence metric improves the human performer’s ability to achieve flow states more readily. Additionally, we demonstrated that the resulting improvisational performances are more likely to be perceived positively by non-expert audiences in terms of musical balance between instruements. These results support our hypothesis that the extra-musical communication of ‘internal state’ of the machine to the human can facilitate more engaging human-machine musical interactions. Our experimentation with the use of biometric data (SC) as a proxy for the performer’s musical engagement that could be communicated to the AI did not improve the performer’s experience of musical flow, despite prior research showing this to be the case with pairs of improvising human musicians [11]. A difference between this previous study and our own was the location of the sensor: the Empatica E4 watch used in our experiments can only be worn on the wrist, whereas the previous study used a sensor attached to the ankle of the performer, to minimise inconsistencies due to movement which are common when improvising during performance. That extra-musical communication of ‘internal state’of the human musician to the machine would also facilitate more engaging human-machine musical interactions was not supported in this study but is also not ruled-out. In further research we aim to draw on other kinds of biometric sensors that are more resilient to the effects of sudden moment that is a necessary part of physical playing and explore other modes of extra-musical communication. Conceptualising intelligent machines as creative partners rather than passive tools or instruments is relatively new. While we have a rich and well explored history of improvisation between human performers to draw upon, improvising with an alien, non-human yet active participant creates many exciting new possibilities for human-machine partnerships. The challenge, which we have begun to explore in this paper, is to maximise the creative benefits and possibilities for both performers and audiences.

"
Towards Collaboration Translucence: Giving Meaning to Multimodal Group Data,https://dl.acm.org/doi/10.1145/3290605.3300269,"
Collocated, face-to-face teamwork remains a pervasive mode of working, which is hard to replicate online. Team members' embodied, multimodal interaction with each other and artefacts has been studied by researchers, but due to its complexity, has remained opaque to automated analysis. However, the ready availability of sensors makes it increasingly affordable to instrument work spaces to study teamwork and groupwork. The possibility of visualising key aspects of a collaboration has huge potential for both academic and professional learning, but a frontline challenge is the enrichment of quantitative data streams with the qualitative insights needed to make sense of them. In response, we introduce the concept of collaboration translucence, an approach to make visible selected features of group activity. This is grounded both theoretically (in the physical, epistemic, social and affective dimensions of group activity), and contextually (using domain-specific concepts). We illustrate the approach from the automated analysis of healthcare simulations to train nurses, generating four visual proxies that fuse multimodal data into higher order patterns. To conclude, there is more going on than is visible to the machines. Our goal is to improve the resources for interpretation where none existed before, in order to provoke more productive reflection and discussion, grounded for the first time in empirical evidence. In educational terms, therefore, collaboration proxies should serve as scaffolds for formative assessment (feedback for ongoing learning) rather than summative assessment (which assigns a grade). Conceivably, as the evidence base grows in size and quality, paterns in the data may be so highly correlated with strong or weak teamwork that they come to serve as proxies for quality. Until then, the priority is to further evaluate how students and educators engage with the representations, and how they can be improved.
"
At Your Service: Designing Voice Assistant Personalities to Improve Automotive User Interfaces,https://dl.acm.org/doi/10.1145/3290605.3300270,"
This paper investigates personalized voice characters for in-car speech interfaces. In particular, we report on how we designed different personalities for voice assistants and compared them in a real world driving study. Voice assistants have become important for a wide range of use cases, yet current interfaces are using the same style of auditory response in every situation, despite varying user needs and personalities. To close this gap, we designed four assistant personalities (Friend, Admirer, Aunt, and Butler) and compared them to a baseline (Default) in a between-subject study in real traffic conditions. Our results show higher likability and trust for assistants that correctly match the user's personality while we observed lower likability, trust, satisfaction, and usefulness for incorrectly matched personalities, each in comparison with the Default character. We discuss design aspects for voice assistants in different automotive use cases. In this paper we explored the influence of personalized voice assistant characters on UX, acceptance, trust, and workload compared to a non-personalized assistant. The results show that personalization has a positive effect on trust and likability if the voice assistant character matches the user’s personality. However, a mismatch can cause displeasure. Future voice assistants need to adapt to the user as well as to the environment. Our findings provoke the personalization of voice assistants not only on a cultural level as it is already happening, but on a context-aware basis, e.g. being short and precise in driving-related situations, and getting chatty on an empty road when the driver is bored. A neutral assistant is recommended as starting point before gradually adjusting its personality to the user’s needs, either through implicit system decisions or explicit user input. Successive work should look into how an optimal assistant personality can be chosen for the driver. Furthermore, it would be interesting to investigate how to transfer our findings to driving settings with higher automation levels.

"
"Toward Algorithmic Accountability in Public Services: A Qualitative Study of Affected Community Perspectives on Algorithmic Decision-making
                     in Child Welfare Services",https://dl.acm.org/doi/10.1145/3290605.3300271,"
Algorithmic decision-making systems are increasingly being adopted by government public service agencies. Researchers, policy experts, and civil rights groups have all voiced concerns that such systems are being deployed without adequate consideration of potential harms, disparate impacts, and public accountability practices. Yet little is known about the concerns of those most likely to be affected by these systems. We report on workshops conducted to learn about the concerns of affected communities in the context of child welfare services. The workshops involved 83 study participants including families involved in the child welfare system, employees of child welfare agencies, and service providers. Our findings indicate that general distrust in the existing system contributes significantly to low comfort in algorithmic decision-making. We identify strategies for improving comfort through greater transparency and improved communication strategies. We discuss the implications of our study for accountable algorithm design for child welfare applications. The fairness and interpretability of algorithms deployed in consequential decision-making settings has received significant attention in recent years. This has led to a numerous proposals for auditing strategies [15, 45], and the development of models that are constructed to be in some sense ‘fair’ by design [2, 23, 30]. Existing work has even explored the algorithmic bias properties of tools deployed in the child welfare system [10]. Our study suggests that these technical solutions are in and of themselves insufficient for ensuring that the resulting algorithmic systems are perceived as fair and just. Perceptions of algorithmic fairness are heavily influenced by perceptions of procedural and interpersonal justice of the child welfare system as a whole. Effective design strategies must therefore consider how technological solutions can be designed to work in concert with complementary policy changes to impact community perceptions of system justice.
"
ActiveInk: (Th)Inking with Data,https://dl.acm.org/doi/10.1145/3290605.3300272,"
During sensemaking, people annotate insights: underlining sentences in a document or circling regions on a map. They jot down their hypotheses: drawing correlation lines on scatterplots or creating personal legends to track patterns. We present ActiveInk, a system enabling people to seamlessly transition between exploring data and externalizing their thoughts using pen and touch. ActiveInk enables the natural use of pen for active reading behaviors, while supporting analytic actions by activating any of these ink strokes. Through a qualitative study with eight participants, we contribute observations of active reading behaviors during data exploration and design principles to support sensemaking. ActiveInk represents a foray into active reading applications for heterogeneous data including visualizations, maps, and documents. It blends the operations of externalizing thoughts with analytic actions in a seamless combination of functions to be carried out with digital pen+touch. The hybrid interface of ActiveInk integrates two ways of working with pen actions, which our study revealed to be complementary for sensemaking activities. Prefix inking is useful for batch operations, while postfix ink activation is useful for interleaving multiple actions with externalizing thoughts. This work offers several opportunities for extension. The ink recognition system we used does not distinguish between classes of marks, such as enclosures, underlines, and arrows. Our data selection model associates marks with any data items enclosed or intersected by an ink stroke. Distinguishing types of mark could be interesting to implement a finer inkdata association strategy. ActiveInk was made to demonstrate the possibilities of thinking with ink, but does not scale to a large number of views or with very large volumes of data. Addressing scalability issues requires further development, and implementing the ability to save, recall, and share analysis canvases. It also implies adding support for a wider diversity of charts, which could be achieved by moving to, e.g., Vega-lite [28]. To better understand the impact of ActiveInk on sensemaking and externalization, including any potential effects on the depth and quality of insights, we would like to run a longitudinal study in which participants analyze their own data using the hybrid interface. We suspect performance may improve with long-term use, and sensemaking strategies may change as people feel more engaged with their data. Furthermore, it would be interesting to study the use of ActiveInk in collaborative synchronous and asynchronous sensemaking scenarios.

"
Evaluating the Effect of Feedback from Different Computer Vision Processing Stages: A Comparative Lab Study,https://dl.acm.org/doi/10.1145/3290605.3300273,"
Computer vision and pattern recognition are increasingly being employed by smartphone and tablet applications targeted at lay-users. An open design challenge is to make such systems intelligible without requiring users to become technical experts. This paper reports a lab study examining the role of visual feedback. Our findings indicate that the stage of processing from which feedback is derived plays an important role in users' ability to develop coherent and correct understandings of a system's operation. Participants in our study showed a tendency to misunderstand the meaning being conveyed by the feedback, relating it to processing outcomes and higher level concepts, when in reality the feedback represented low level features. Drawing on the experimental results and the qualitative data collected, we discuss the challenges of designing interactions around pattern matching algorithms. This paper reported a comparative between-groups lab study examining the role of visual feedback in smart camera apps. Leveraging a novel experimental design centered on the creation of stop-motion animations, 40 participants were exposed to four different levels of feedback. Through a combination of quantitative and qualitative methods, our findings indicate a disconnect between user expectations and the information actually represented by the feedback. Participants exposed to keypoint marker feedback derived from early stages of processing showed a tendency to misunderstand it and overall they performed worse than participants who received no feedback at all. Conversely, participants who received keypoint marker feedback derived from later stages of processing demonstrated an improved understanding of the system operation. We conclude that the stage of processing from which feedback is derived plays an important role in users’ ability to develop coherent and correct understandings of a system’s operation. We hope that the results presented in this paper will inform the design of feedback in smart camera apps, and other applications of pattern recognition. More generally, we hope that our study method can be used by HCI researchers in future work exploring the design space of feedback and cues.

"
Smart and Fermented Cities: An Approach to Placemaking in Urban Informatics,https://dl.acm.org/doi/10.1145/3290605.3300274,"
What makes a city meaningful to its residents? What attracts people to live in a city and to care for it? Today, we might see such questions as concerns for HCI, given the emerging agendas of smart and connected cities, IoT, and ubiquitous computing: city residents' perceptions of and attitudes towards smart city technologies will play a role in technology acceptance. Theories of ""placemaking"" from humanist geography and urban planning address themselves to such concerns, and they have been taken up in HCI and urban informatics research. This theory offers ideas for developing community attachment, heightening the legibility of the city, and intensifying lived experiences in the city. We add to this body of research with an analysis of several initiatives of City Yeast, a community-based design collective in Taiwan that proposes the metaphor of fermentation as an approach to placemaking. We unpack how this approach shapes their design practice and link its implications to urban informatics research in HCI. We suggest that smart cities can also be pursued by leveraging the knowledge of city residents and helping to facilitate their participation in acts of perceiving, envisioning, and improving their local communities, including but not limited to smart and connected technologies. We have shown that many citizens of Taipei feel that the city lacks a global identity and that any initiative to make it smart and connected should build on such an identity. In pursuing such an identity collectively, City Yeast focuses on exploring current issues in Taipei’s urban design and city infrastructure and experimenting with (sometimes symbolic) strategies to redesign Taipei for its future. We have also found that citizens fear that smart city technologies – IoT, sensors, mobile networks, and so on – comprise a globalgeneric infrastructure. Similar to sky-scrapers and modern grocery stores, this new infrastructure threatensthe vibrancy of their city even as it modernizes it. In what follows, we develop our thoughts on how the City Yeast approach relates to placemaking by 1) focusing on how smart and connected cities agendas might be joined to an urban identity project as a part of its envisioning and implementation; 2) leveraging the knowledge of city dwellers and helping to facilitate their participation in acts of perceiving, envisioning, and improving their local communities; and 3) ofering design implications for smart city technologists.
"
Smart Home Security Cameras and Shifting Lines of Creepiness: A Design-Led Inquiry,https://dl.acm.org/doi/10.1145/3290605.3300275,"
Through a design-led inquiry focused on smart home security cameras, this research develops three key concepts for research and design pertaining to new and emerging digital consumer technologies. Digital leakage names the propensity for digital information to be shared, stolen, and misused in ways unbeknownst or even harmful to those to whom the data pertains or belongs. Hole-and-corner applications are those functions connected to users' data, devices, and interactions yet concealed from or downplayed to them, often because they are non-beneficial or harmful to them. Foot-in-the-door devices are product and services with functional offerings and affordances that work to normalize and integrate a technology, thus laying groundwork for future adoption of features that might have earlier been rejected as unacceptable or unnecessary. Developed and illustrated through a set of design studies and explorations, this paper shows how these concepts may be used analytically to investigate issues such as privacy and security, anticipatorily to speculate about the future of technology development and use, and generatively to synthesize design concepts and solutions. This research set out to investigate shifting and retreating lines of creepiness in the emerging smart home by focusing on smart home security cameras. Through a process of closely analyzing existing design interfaces combined with generating novel design scenarios and proposals, this inquiry has developed and illustrated three key concepts: digital leakage, hole-and-corner applications, and foot-in-thedoor devices. This paper has introduced these concepts and shown how they may be used analytically to understand relationships between interactive technology, user experience, and issues of privacy, security, trust, accountable, and fairness. These concepts may also be used anticipatorily and generatively, as this paper has shown, to extrapolate future trends and speculate about future possibilities, and to generate design interventions, solutions, and other design-oriented responses. While this paper makes minor contributions with regards to analyzing, anticipating, and generating specific designs related to smart home security cameras, the core contribution is to develop and present new and refined vocabulary for understanding, discussing, and addressing timely social and ethical issues with smart technologies. This contribution builds upon and adds to theoretical, empirical, and critical scholarship that has proposed similar concepts for understanding issues such as privacy and surveillance—such as Nissenbaum’s general theory of contextual integrity [[52]] and Zubeff’s concept of surveillance capitalism [[78]]. The three concepts developed in this research, however, are distinct from those developed in prior research in that they both arise from and are directed toward design broadly and interfaces, interactions, and user experiences specifically. These concepts allow us to go beyond generally labeling certain events as creepy, as invasions of privacy, or as breaches of trust by focusing on specific mechanisms by which design and technology lead to negative experiences and outcomes. By expanding our vocabulary through concepts such as digital leakage, holeand-corner applications, and foot-in-the-door devices, we increase our capacity as designers, researchers, and critics to concretely analyze, discuss, debate, and address the dizzying array of existing and emerging issues at hand.
"
"Deaf and Hard-of-hearing Individuals' Preferences for Wearable and Mobile Sound Awareness
                     Technologies",https://dl.acm.org/doi/10.1145/3290605.3300276,"
To investigate preferences for mobile and wearable sound awareness systems, we conducted an online survey with 201 DHH participants. The survey explores how demographic factors affect perceptions of sound awareness technologies, gauges interest in specific sounds and sound characteristics, solicits reactions to three design scenarios (smartphone, smartwatch, head-mounted display) and two output modalities (visual, haptic), and probes issues related to social context of use. While most participants were highly interested in being aware of sounds, this interest was modulated by communication preference--that is, for sign or oral communication or both. Almost all participants wanted both visual and haptic feedback and 75% preferred to have that feedback on separate devices (e.g., haptic on smartwatch, visual on head-mounted display). Other findings related to sound type, full captions vs. keywords, sound filtering, notification styles, and social context provide direct guidance for the design of future mobile and wearable sound awareness systems. We presented an online survey with 201 DHH participants investigating interest in sound awareness and preferences about the design of a mobile or wearable sound awareness technology. This study builds on past work on sound interests [3, 27, 39] to quantitatively examine the influence of demographic factors on interest level. We also specifically examine mobile and wearable form factors and feedback modalities. Results show a strong preference for having both haptic and visual feedback, the latter particularly for captions, with the most preferred device design being haptic notifications on a smartwatch and visual information on a head-mounted display or smartphone. Finally, our findings surface important cultural and social considerations that will need to be addressed for the successful adoption of mobile or wearable sound awareness technologies, such as a hesitance to use a sound awareness device with strangers or around Deaf friends or family.
"
